<?xml version="1.0"?>
<!DOCTYPE Report
[
<!ELEMENT Report (General ,(Doc|BPT)) >
<!ATTLIST Report ver CDATA #REQUIRED tmZone CDATA #REQUIRED>

<!ELEMENT General ( DocLocation ) >
<!ATTLIST General productName CDATA #REQUIRED productVer CDATA #REQUIRED os CDATA #REQUIRED host CDATA #REQUIRED qcserver CDATA #IMPLIED qcproject CDATA #IMPLIED SolManSolutionId CDATA #IMPLIED SolManProjectId CDATA #IMPLIED SolManTestPlanId CDATA #IMPLIED SolManTestPackageId CDATA #IMPLIED SolManUserInfoData CDATA #IMPLIED  >

<!ELEMENT BPT (DName,Res,DVer?,TSet?,TInst?,NodeArgs,AdditionalInfo*,Doc*) >
<!ATTLIST BPT rID ID #REQUIRED >

<!ELEMENT Doc (DName,ConfName?,Res,DVer?,TSet?,TInst?,RunType?,DT?,AdditionalInfo*,Step*,DIter*,Step*,Action*,Doc*,Summary?,TestMaintenanceSummary*,NodeArgs?) >
<!ATTLIST Doc rID ID #REQUIRED type (Test|BC|BPTWrapperTest|Flow|Group|Action) "Test" productName CDATA #REQUIRED BCIter CDATA #IMPLIED >

<!ELEMENT RunType ( #PCDATA )>
<!ATTLIST RunType fmStep (False|True) "False" batch (False|True) "False" upDesc (False|True) "False" upChk (False|True) "False" upAS (False|True) "False">

<!ELEMENT DName ( #PCDATA ) >

<!ELEMENT ConfName ( #PCDATA ) >

<!ELEMENT Res ( #PCDATA ) >

<!ELEMENT AdditionalInfo (AdditionalDataName,AdditionalDataValue ) >

<!ELEMENT AdditionalDataName ( #PCDATA ) >

<!ELEMENT AdditionalDataValue ( #PCDATA ) >

<!ELEMENT DVer ( #PCDATA ) >

<!ELEMENT TSet ( #PCDATA ) >

<!ELEMENT TInst ( #PCDATA ) >

<!ELEMENT DIter (Step*,Action+,Summary?,NodeArgs)>
<!ATTLIST DIter rID ID #REQUIRED iterID CDATA #REQUIRED>

<!ELEMENT DocLocation ( #PCDATA )>

<!ELEMENT Action (AName,AIter*,(Step|HtmlStep|Action)*, Summary,ActionMaintenanceSummary*, NodeArgs ) >
<!ATTLIST Action rID ID #REQUIRED>

<!ELEMENT AIter ((Step|HtmlStep|Action)*,DataMapping?, Summary?,NodeArgs) >
<!ATTLIST AIter rID ID #REQUIRED iterID CDATA #REQUIRED isCountable (False|True) "False" >

<!ELEMENT AName ( #PCDATA ) >

<!ELEMENT TestMaintenanceSummary (ActionMaintenanceSummary*) >
<!ATTLIST TestMaintenanceSummary ObjectsAdded CDATA #REQUIRED ObjectsUpdated CDATA #REQUIRED StepsUpdated CDATA #REQUIRED StepsComments CDATA #REQUIRED><!ELEMENT ActionMaintenanceSummary (ObjectChange* ) >
<!ATTLIST ActionMaintenanceSummary Action CDATA #REQUIRED Objects CDATA #REQUIRED Updated CDATA #REQUIRED LinesTotal CDATA #REQUIRED Added CDATA #REQUIRED LinesUpdated CDATA #REQUIRED>

<!ELEMENT ObjectChange  (Hierarchy, PropertyChangeList* ) >
<!ATTLIST ObjectChange Operation CDATA #IMPLIED OriginalRepository CDATA #IMPLIED>

<!ELEMENT PropertyChangeList (PropertyDef*) >

<!ELEMENT PropertyDef (OriginalValue, NewValue) >
<!ATTLIST PropertyDef PropName CDATA #REQUIRED OriginRegularExpression (True|False) "False" NewRegularExpression (True|False) "False" AddedProperty (True|False) "False" >

<!ELEMENT OriginalValue ( #PCDATA )>

<!ELEMENT NewValue ( #PCDATA )>

<!ELEMENT Hierarchy  (ObjectName, Hierarchy*) >
<!ATTLIST Hierarchy MicClass CDATA #REQUIRED>

<!ELEMENT ObjectName  ( #PCDATA ) >

<!ELEMENT Step (Obj,Details,Time,TimeTick* ,(Step|HtmlStep|Doc)*, DataMapping?, NodeArgs) >
<!ATTLIST Step rID ID #REQUIRED retval CDATA #IMPLIED>

<!ELEMENT HtmlStep (HTML,TimeTick*,(Step|HtmlStep|Doc)*,NodeArgs) >
<!ATTLIST HtmlStep rID ID #REQUIRED >

<!ELEMENT Obj ( #PCDATA ) >
<!ATTLIST Obj plainTxt (False|True) "True">

<!ELEMENT Details ( #PCDATA ) >
<!ATTLIST Details plainTxt (False|True) "True">

<!ELEMENT Time ( #PCDATA ) >

<!ELEMENT HTML ( #PCDATA ) >

<!ELEMENT Disp ( #PCDATA ) >

<!ELEMENT TimeTick ( #PCDATA ) >

<!ELEMENT DataMapping ( DataMappedItem* )>
<!ELEMENT DataMappedItem EMPTY >
<!ATTLIST DataMappedItem dsName CDATA #REQUIRED >
<!ATTLIST DataMappedItem rowId CDATA #REQUIRED >

<!ELEMENT NodeArgs (Disp,TopPane?,BtmPane?,ExtendedInfo? )>
<!ATTLIST NodeArgs eType CDATA #REQUIRED icon CDATA #REQUIRED nRep CDATA #REQUIRED UserNote CDATA #IMPLIED filter (False|True) "True">
<!ATTLIST NodeArgs status (Passed|Failed|Done|Warning|Information) "Done">
<!ATTLIST NodeArgs iconSel CDATA #IMPLIED nType CDATA #IMPLIED MovieMarker CDATA "">
<!ATTLIST NodeArgs Source CDATA #IMPLIED SourceLine CDATA #IMPLIED StepFlowItemKey CDATA #IMPLIED >

<!ELEMENT TopPane (Path)>

<!ELEMENT BtmPane ( (Path|WR)?,ASHilite?)>
<!ATTLIST BtmPane vType CDATA "HTML">

<!ELEMENT Path ( #PCDATA ) >

<!ELEMENT ASHilite ( #PCDATA ) >

<!ELEMENT WR ( #PCDATA ) >

<!ELEMENT ExtendedInfo ( StepData ) >

<!ATTLIST ExtendedInfo StepType CDATA #REQUIRED>
<!ELEMENT DT (NodeArgs) >
<!ATTLIST DT rID ID #REQUIRED>

<!ELEMENT Summary (Param*)>
<!ATTLIST Summary sTime CDATA #IMPLIED eTime CDATA #IMPLIED passed CDATA #IMPLIED failed CDATA #IMPLIED warnings CDATA #IMPLIED retval CDATA #IMPLIED stopped (False|True) "False" >

<!ELEMENT Param (ParamName,ParamVal)+ >
<!ATTLIST Param paramInOut (In|Out) "In">

<!ELEMENT ParamName ( #PCDATA ) >

<!ELEMENT ParamVal ( #PCDATA ) >

]
>
<Report ver="2.0" tmZone="India Standard Time">
<General productName="HPE Unified Functional Testing" productVer="14.03" os="" host="DESKTOP-FO6JLLM"><DocLocation><![CDATA[E:\DataDrivenFramework\Driver\Driver4]]></DocLocation></General>
<Doc rID="T1"   productName= "HPE Unified Functional Testing"  >
<DName><![CDATA[Driver4]]></DName>
<Res><![CDATA[Res35]]></Res>
<DT rID="T2">
<NodeArgs eType="Table" icon="2" nRep="4" filter="False" >
<Disp><![CDATA[Run-Time Data Table]]></Disp>
<BtmPane vType="Table" >
<Path><![CDATA[Default.xls]]></Path>
</BtmPane>
</NodeArgs>
</DT>
<DIter rID="T3" iterID="1" >
<Action rID="T4">
<AName><![CDATA[Action1]]></AName>
<Step rID="T5">
<Obj plainTxt="False" ><![CDATA[tr1]]></Obj>
<Details plainTxt="False" ><![CDATA[Transaction "tr1" started.]]></Details>
<Time><![CDATA[30-03-2022 - 21:09:06]]></Time>
<TimeTick>1648654746</TimeTick>
<NodeArgs eType="Transaction" icon="5" nRep="8" nType="Start Transaction" Source="Action1" SourceLine="8" >
<Disp><![CDATA[tr1]]></Disp>
</NodeArgs>
</Step>
<Step rID="T6">
<Obj plainTxt="False" ><![CDATA[HPE MyFlight Sample Applicatio]]></Obj>
<Details plainTxt="False" ><![CDATA[WpfWindow]]></Details>
<Time><![CDATA[30-03-2022 - 21:09:41]]></Time>
<TimeTick>1648654781</TimeTick>
<Step rID="T7">
<Obj plainTxt="False" ><![CDATA[WpfTabStrip]]></Obj>
<Details plainTxt="False" ><![CDATA[Cannot&nbsp;find&nbsp;the&nbsp;"WpfTabStrip"&nbsp;object's&nbsp;parent&nbsp;"HPE&nbsp;MyFlight&nbsp;Sample&nbsp;Applicatio"&nbsp;(class&nbsp;WpfWindow).<br/>Verify&nbsp;that&nbsp;parent&nbsp;properties&nbsp;match&nbsp;an&nbsp;object&nbsp;currently&nbsp;displayed&nbsp;in&nbsp;your&nbsp;application.]]></Details>
<Time><![CDATA[30-03-2022 - 21:09:41]]></Time>
<TimeTick>1648654781</TimeTick>
<Step rID="T8">
<Obj plainTxt="False" ><![CDATA[HPE MyFlight Sample Applicatio]]></Obj>
<Details plainTxt="False" ><![CDATA[Object's physical description:<br>wpftypename = window<br>regexpwndtitle = HPE MyFlight Sample Application<br>devname = HPE MyFlight Sample Application<br>]]></Details>
<Time><![CDATA[30-03-2022 - 21:09:41]]></Time>
<TimeTick>1648654781</TimeTick>
<NodeArgs eType="Replay" icon="8" nRep="71" status="Warning" nType="Parent description" >
<Disp><![CDATA[HPE MyFlight Sample Applicatio]]></Disp>
</NodeArgs>
</Step>
<NodeArgs eType="Replay" icon="7" nRep="70" status="Failed" nType="Run Error" >
<Disp><![CDATA[WpfTabStrip]]></Disp>
</NodeArgs>
</Step>
<NodeArgs eType="Context" icon="6" nRep="69" status="Failed" >
<Disp><![CDATA[HPE MyFlight Sample Applicatio]]></Disp>
</NodeArgs>
</Step>
<Step rID="T9">
<Obj plainTxt="False" ><![CDATA[HPE MyFlight Sample Applicatio]]></Obj>
<Details plainTxt="False" ><![CDATA[WpfWindow]]></Details>
<Time><![CDATA[30-03-2022 - 21:09:41]]></Time>
<TimeTick>1648654781</TimeTick>
<Step rID="T10">
<Obj plainTxt="False" ><![CDATA[Run Error]]></Obj>
<Details plainTxt="False" ><![CDATA[Cannot find the &quot;WpfTabStrip&quot; object's parent &quot;HPE MyFlight Sample Applicatio&quot; (class WpfWindow).<BR/>Verify that parent properties match an object currently displayed in your application.<BR/>Function file: E:\DataDrivenFramework\Driver\Driver4\Library1.qfl<BR/>Line (31): &quot;WpfWindow(&quot;HPE MyFlight Sample Applicatio&quot;).WpfTabStrip(&quot;WpfTabStrip&quot;).Select &quot;SEARCH ORDER&quot;&quot;.]]></Details>
<Time><![CDATA[30-03-2022 - 21:09:41]]></Time>
<TimeTick>1648654781</TimeTick>
<NodeArgs eType="Replay" icon="8" nRep="73" status="Failed" Source="E:\DataDrivenFramework\Driver\Driver4\Library1.qfl" SourceLine="30" >
<Disp><![CDATA[Run Error]]></Disp>
</NodeArgs>
</Step>
<Step rID="T11">
<Obj plainTxt="False" ><![CDATA[byNumberRadio]]></Obj>
<Details plainTxt="False" ><![CDATA[Cannot&nbsp;find&nbsp;the&nbsp;"byNumberRadio"&nbsp;object's&nbsp;parent&nbsp;"HPE&nbsp;MyFlight&nbsp;Sample&nbsp;Applicatio"&nbsp;(class&nbsp;WpfWindow).<br/>Verify&nbsp;that&nbsp;parent&nbsp;properties&nbsp;match&nbsp;an&nbsp;object&nbsp;currently&nbsp;displayed&nbsp;in&nbsp;your&nbsp;application.]]></Details>
<Time><![CDATA[30-03-2022 - 21:10:20]]></Time>
<TimeTick>1648654820</TimeTick>
<Step rID="T12">
<Obj plainTxt="False" ><![CDATA[HPE MyFlight Sample Applicatio]]></Obj>
<Details plainTxt="False" ><![CDATA[Object's physical description:<br>wpftypename = window<br>regexpwndtitle = HPE MyFlight Sample Application<br>devname = HPE MyFlight Sample Application<br>]]></Details>
<Time><![CDATA[30-03-2022 - 21:10:20]]></Time>
<TimeTick>1648654820</TimeTick>
<NodeArgs eType="Replay" icon="8" nRep="79" status="Warning" nType="Parent description" Source="E:\DataDrivenFramework\Driver\Driver4\Library1.qfl" SourceLine="-1" >
<Disp><![CDATA[HPE MyFlight Sample Applicatio]]></Disp>
</NodeArgs>
</Step>
<NodeArgs eType="Replay" icon="9" nRep="78" status="Failed" nType="Run Error" Source="E:\DataDrivenFramework\Driver\Driver4\Library1.qfl" SourceLine="-1" >
<Disp><![CDATA[byNumberRadio]]></Disp>
</NodeArgs>
</Step>
<NodeArgs eType="Context" icon="6" nRep="72" status="Failed" Source="E:\DataDrivenFramework\Driver\Driver4\Library1.qfl" SourceLine="-1" >
<Disp><![CDATA[HPE MyFlight Sample Applicatio]]></Disp>
</NodeArgs>
</Step>
<Step rID="T13">
<Obj plainTxt="False" ><![CDATA[HPE MyFlight Sample Applicatio]]></Obj>
<Details plainTxt="False" ><![CDATA[WpfWindow]]></Details>
<Time><![CDATA[30-03-2022 - 21:10:20]]></Time>
<TimeTick>1648654820</TimeTick>
<Step rID="T14">
<Obj plainTxt="False" ><![CDATA[Run Error]]></Obj>
<Details plainTxt="False" ><![CDATA[Cannot find the &quot;byNumberRadio&quot; object's parent &quot;HPE MyFlight Sample Applicatio&quot; (class WpfWindow).<BR/>Verify that parent properties match an object currently displayed in your application.<BR/>Function file: E:\DataDrivenFramework\Driver\Driver4\Library1.qfl<BR/>Line (32): &quot;WpfWindow(&quot;HPE MyFlight Sample Applicatio&quot;).WpfRadioButton(&quot;byNumberRadio&quot;).Set&quot;.]]></Details>
<Time><![CDATA[30-03-2022 - 21:10:20]]></Time>
<TimeTick>1648654820</TimeTick>
<NodeArgs eType="Replay" icon="8" nRep="81" status="Failed" Source="E:\DataDrivenFramework\Driver\Driver4\Library1.qfl" SourceLine="31" >
<Disp><![CDATA[Run Error]]></Disp>
</NodeArgs>
</Step>
<Step rID="T15">
<Obj plainTxt="False" ><![CDATA[byNumberWatermark]]></Obj>
<Details plainTxt="False" ><![CDATA[Cannot&nbsp;find&nbsp;the&nbsp;"byNumberWatermark"&nbsp;object's&nbsp;parent&nbsp;"HPE&nbsp;MyFlight&nbsp;Sample&nbsp;Applicatio"&nbsp;(class&nbsp;WpfWindow).<br/>Verify&nbsp;that&nbsp;parent&nbsp;properties&nbsp;match&nbsp;an&nbsp;object&nbsp;currently&nbsp;displayed&nbsp;in&nbsp;your&nbsp;application.]]></Details>
<Time><![CDATA[30-03-2022 - 21:10:41]]></Time>
<TimeTick>1648654841</TimeTick>
<Step rID="T16">
<Obj plainTxt="False" ><![CDATA[HPE MyFlight Sample Applicatio]]></Obj>
<Details plainTxt="False" ><![CDATA[Object's physical description:<br>wpftypename = window<br>regexpwndtitle = HPE MyFlight Sample Application<br>devname = HPE MyFlight Sample Application<br>]]></Details>
<Time><![CDATA[30-03-2022 - 21:10:41]]></Time>
<TimeTick>1648654841</TimeTick>
<NodeArgs eType="Replay" icon="8" nRep="91" status="Warning" nType="Parent description" Source="E:\DataDrivenFramework\Driver\Driver4\Library1.qfl" SourceLine="-1" >
<Disp><![CDATA[HPE MyFlight Sample Applicatio]]></Disp>
</NodeArgs>
</Step>
<NodeArgs eType="Replay" icon="10" nRep="90" status="Failed" nType="Run Error" Source="E:\DataDrivenFramework\Driver\Driver4\Library1.qfl" SourceLine="-1" >
<Disp><![CDATA[byNumberWatermark]]></Disp>
</NodeArgs>
</Step>
<NodeArgs eType="Context" icon="6" nRep="80" status="Failed" Source="E:\DataDrivenFramework\Driver\Driver4\Library1.qfl" SourceLine="-1" >
<Disp><![CDATA[HPE MyFlight Sample Applicatio]]></Disp>
</NodeArgs>
</Step>
<Step rID="T17">
<Obj plainTxt="False" ><![CDATA[HPE MyFlight Sample Applicatio]]></Obj>
<Details plainTxt="False" ><![CDATA[WpfWindow]]></Details>
<Time><![CDATA[30-03-2022 - 21:10:41]]></Time>
<TimeTick>1648654841</TimeTick>
<Step rID="T18">
<Obj plainTxt="False" ><![CDATA[Run Error]]></Obj>
<Details plainTxt="False" ><![CDATA[Cannot find the &quot;byNumberWatermark&quot; object's parent &quot;HPE MyFlight Sample Applicatio&quot; (class WpfWindow).<BR/>Verify that parent properties match an object currently displayed in your application.<BR/>Function file: E:\DataDrivenFramework\Driver\Driver4\Library1.qfl<BR/>Line (33): &quot;WpfWindow(&quot;HPE MyFlight Sample Applicatio&quot;).WpfEdit(&quot;byNumberWatermark&quot;).Set &quot;7&quot;&quot;.]]></Details>
<Time><![CDATA[30-03-2022 - 21:10:41]]></Time>
<TimeTick>1648654841</TimeTick>
<NodeArgs eType="Replay" icon="8" nRep="93" status="Failed" Source="E:\DataDrivenFramework\Driver\Driver4\Library1.qfl" SourceLine="32" >
<Disp><![CDATA[Run Error]]></Disp>
</NodeArgs>
</Step>
<Step rID="T19">
<Obj plainTxt="False" ><![CDATA[SEARCH]]></Obj>
<Details plainTxt="False" ><![CDATA[Cannot&nbsp;find&nbsp;the&nbsp;"SEARCH"&nbsp;object's&nbsp;parent&nbsp;"HPE&nbsp;MyFlight&nbsp;Sample&nbsp;Applicatio"&nbsp;(class&nbsp;WpfWindow).<br/>Verify&nbsp;that&nbsp;parent&nbsp;properties&nbsp;match&nbsp;an&nbsp;object&nbsp;currently&nbsp;displayed&nbsp;in&nbsp;your&nbsp;application.]]></Details>
<Time><![CDATA[30-03-2022 - 21:11:02]]></Time>
<TimeTick>1648654862</TimeTick>
<Step rID="T20">
<Obj plainTxt="False" ><![CDATA[HPE MyFlight Sample Applicatio]]></Obj>
<Details plainTxt="False" ><![CDATA[Object's physical description:<br>wpftypename = window<br>regexpwndtitle = HPE MyFlight Sample Application<br>devname = HPE MyFlight Sample Application<br>]]></Details>
<Time><![CDATA[30-03-2022 - 21:11:02]]></Time>
<TimeTick>1648654862</TimeTick>
<NodeArgs eType="Replay" icon="8" nRep="103" status="Warning" nType="Parent description" Source="E:\DataDrivenFramework\Driver\Driver4\Library1.qfl" SourceLine="-1" >
<Disp><![CDATA[HPE MyFlight Sample Applicatio]]></Disp>
</NodeArgs>
</Step>
<NodeArgs eType="Replay" icon="11" nRep="102" status="Failed" nType="Run Error" Source="E:\DataDrivenFramework\Driver\Driver4\Library1.qfl" SourceLine="-1" >
<Disp><![CDATA[SEARCH]]></Disp>
</NodeArgs>
</Step>
<NodeArgs eType="Context" icon="6" nRep="92" status="Failed" Source="E:\DataDrivenFramework\Driver\Driver4\Library1.qfl" SourceLine="-1" >
<Disp><![CDATA[HPE MyFlight Sample Applicatio]]></Disp>
</NodeArgs>
</Step>
<Step rID="T21">
<Obj plainTxt="False" ><![CDATA[HPE MyFlight Sample Applicatio]]></Obj>
<Details plainTxt="False" ><![CDATA[WpfWindow]]></Details>
<Time><![CDATA[30-03-2022 - 21:11:02]]></Time>
<TimeTick>1648654862</TimeTick>
<Step rID="T22">
<Obj plainTxt="False" ><![CDATA[Run Error]]></Obj>
<Details plainTxt="False" ><![CDATA[Cannot find the &quot;SEARCH&quot; object's parent &quot;HPE MyFlight Sample Applicatio&quot; (class WpfWindow).<BR/>Verify that parent properties match an object currently displayed in your application.<BR/>Function file: E:\DataDrivenFramework\Driver\Driver4\Library1.qfl<BR/>Line (34): &quot;WpfWindow(&quot;HPE MyFlight Sample Applicatio&quot;).WpfButton(&quot;SEARCH&quot;).Click&quot;.]]></Details>
<Time><![CDATA[30-03-2022 - 21:11:02]]></Time>
<TimeTick>1648654862</TimeTick>
<NodeArgs eType="Replay" icon="8" nRep="105" status="Failed" Source="E:\DataDrivenFramework\Driver\Driver4\Library1.qfl" SourceLine="33" >
<Disp><![CDATA[Run Error]]></Disp>
</NodeArgs>
</Step>
<Step rID="T23">
<Obj plainTxt="False" ><![CDATA[NEW SEARCH]]></Obj>
<Details plainTxt="False" ><![CDATA[Cannot&nbsp;find&nbsp;the&nbsp;"NEW&nbsp;SEARCH"&nbsp;object's&nbsp;parent&nbsp;"HPE&nbsp;MyFlight&nbsp;Sample&nbsp;Applicatio"&nbsp;(class&nbsp;WpfWindow).<br/>Verify&nbsp;that&nbsp;parent&nbsp;properties&nbsp;match&nbsp;an&nbsp;object&nbsp;currently&nbsp;displayed&nbsp;in&nbsp;your&nbsp;application.]]></Details>
<Time><![CDATA[30-03-2022 - 21:11:24]]></Time>
<TimeTick>1648654884</TimeTick>
<Step rID="T24">
<Obj plainTxt="False" ><![CDATA[HPE MyFlight Sample Applicatio]]></Obj>
<Details plainTxt="False" ><![CDATA[Object's physical description:<br>wpftypename = window<br>regexpwndtitle = HPE MyFlight Sample Application<br>devname = HPE MyFlight Sample Application<br>]]></Details>
<Time><![CDATA[30-03-2022 - 21:11:24]]></Time>
<TimeTick>1648654884</TimeTick>
<NodeArgs eType="Replay" icon="8" nRep="115" status="Warning" nType="Parent description" Source="E:\DataDrivenFramework\Driver\Driver4\Library1.qfl" SourceLine="-1" >
<Disp><![CDATA[HPE MyFlight Sample Applicatio]]></Disp>
</NodeArgs>
</Step>
<NodeArgs eType="Replay" icon="11" nRep="114" status="Failed" nType="Run Error" Source="E:\DataDrivenFramework\Driver\Driver4\Library1.qfl" SourceLine="-1" >
<Disp><![CDATA[NEW SEARCH]]></Disp>
</NodeArgs>
</Step>
<NodeArgs eType="Context" icon="6" nRep="104" status="Failed" Source="E:\DataDrivenFramework\Driver\Driver4\Library1.qfl" SourceLine="-1" >
<Disp><![CDATA[HPE MyFlight Sample Applicatio]]></Disp>
</NodeArgs>
</Step>
<Step rID="T25">
<Obj plainTxt="False" ><![CDATA[HPE MyFlight Sample Applicatio]]></Obj>
<Details plainTxt="False" ><![CDATA[WpfWindow]]></Details>
<Time><![CDATA[30-03-2022 - 21:11:24]]></Time>
<TimeTick>1648654884</TimeTick>
<Step rID="T26">
<Obj plainTxt="False" ><![CDATA[Run Error]]></Obj>
<Details plainTxt="False" ><![CDATA[Cannot find the &quot;NEW SEARCH&quot; object's parent &quot;HPE MyFlight Sample Applicatio&quot; (class WpfWindow).<BR/>Verify that parent properties match an object currently displayed in your application.<BR/>Function file: E:\DataDrivenFramework\Driver\Driver4\Library1.qfl<BR/>Line (35): &quot;WpfWindow(&quot;HPE MyFlight Sample Applicatio&quot;).WpfButton(&quot;NEW SEARCH&quot;).Click&quot;.]]></Details>
<Time><![CDATA[30-03-2022 - 21:11:24]]></Time>
<TimeTick>1648654884</TimeTick>
<NodeArgs eType="Replay" icon="8" nRep="117" status="Failed" Source="E:\DataDrivenFramework\Driver\Driver4\Library1.qfl" SourceLine="34" >
<Disp><![CDATA[Run Error]]></Disp>
</NodeArgs>
</Step>
<Step rID="T27">
<Obj plainTxt="False" ><![CDATA[WpfTabStrip]]></Obj>
<Details plainTxt="False" ><![CDATA[Cannot&nbsp;find&nbsp;the&nbsp;"WpfTabStrip"&nbsp;object's&nbsp;parent&nbsp;"HPE&nbsp;MyFlight&nbsp;Sample&nbsp;Applicatio"&nbsp;(class&nbsp;WpfWindow).<br/>Verify&nbsp;that&nbsp;parent&nbsp;properties&nbsp;match&nbsp;an&nbsp;object&nbsp;currently&nbsp;displayed&nbsp;in&nbsp;your&nbsp;application.]]></Details>
<Time><![CDATA[30-03-2022 - 21:11:24]]></Time>
<TimeTick>1648654884</TimeTick>
<Step rID="T28">
<Obj plainTxt="False" ><![CDATA[HPE MyFlight Sample Applicatio]]></Obj>
<Details plainTxt="False" ><![CDATA[Object's physical description:<br>wpftypename = window<br>regexpwndtitle = HPE MyFlight Sample Application<br>devname = HPE MyFlight Sample Application<br>]]></Details>
<Time><![CDATA[30-03-2022 - 21:11:24]]></Time>
<TimeTick>1648654884</TimeTick>
<NodeArgs eType="Replay" icon="8" nRep="119" status="Warning" nType="Parent description" >
<Disp><![CDATA[HPE MyFlight Sample Applicatio]]></Disp>
</NodeArgs>
</Step>
<NodeArgs eType="Replay" icon="7" nRep="118" status="Failed" nType="Run Error" >
<Disp><![CDATA[WpfTabStrip]]></Disp>
</NodeArgs>
</Step>
<Step rID="T29">
<Obj plainTxt="False" ><![CDATA[WpfTabStrip]]></Obj>
<Details plainTxt="False" ><![CDATA[Cannot&nbsp;find&nbsp;the&nbsp;"WpfTabStrip"&nbsp;object's&nbsp;parent&nbsp;"HPE&nbsp;MyFlight&nbsp;Sample&nbsp;Applicatio"&nbsp;(class&nbsp;WpfWindow).<br/>Verify&nbsp;that&nbsp;parent&nbsp;properties&nbsp;match&nbsp;an&nbsp;object&nbsp;currently&nbsp;displayed&nbsp;in&nbsp;your&nbsp;application.]]></Details>
<Time><![CDATA[30-03-2022 - 21:11:45]]></Time>
<TimeTick>1648654905</TimeTick>
<Step rID="T30">
<Obj plainTxt="False" ><![CDATA[HPE MyFlight Sample Applicatio]]></Obj>
<Details plainTxt="False" ><![CDATA[Object's physical description:<br>wpftypename = window<br>regexpwndtitle = HPE MyFlight Sample Application<br>devname = HPE MyFlight Sample Application<br>]]></Details>
<Time><![CDATA[30-03-2022 - 21:11:45]]></Time>
<TimeTick>1648654905</TimeTick>
<NodeArgs eType="Replay" icon="8" nRep="129" status="Warning" nType="Parent description" >
<Disp><![CDATA[HPE MyFlight Sample Applicatio]]></Disp>
</NodeArgs>
</Step>
<NodeArgs eType="Replay" icon="7" nRep="128" status="Failed" nType="Run Error" >
<Disp><![CDATA[WpfTabStrip]]></Disp>
</NodeArgs>
</Step>
<NodeArgs eType="Context" icon="6" nRep="116" status="Failed" Source="E:\DataDrivenFramework\Driver\Driver4\Library1.qfl" SourceLine="-1" >
<Disp><![CDATA[HPE MyFlight Sample Applicatio]]></Disp>
</NodeArgs>
</Step>
<Step rID="T31">
<Obj plainTxt="False" ><![CDATA[HPE MyFlight Sample Applicatio]]></Obj>
<Details plainTxt="False" ><![CDATA[WpfWindow]]></Details>
<Time><![CDATA[30-03-2022 - 21:11:45]]></Time>
<TimeTick>1648654905</TimeTick>
<Step rID="T32">
<Obj plainTxt="False" ><![CDATA[Run Error]]></Obj>
<Details plainTxt="False" ><![CDATA[Cannot find the &quot;WpfTabStrip&quot; object's parent &quot;HPE MyFlight Sample Applicatio&quot; (class WpfWindow).<BR/>Verify that parent properties match an object currently displayed in your application.<BR/>Function file: E:\DataDrivenFramework\Driver\Driver4\Library1.qfl<BR/>Line (31): &quot;WpfWindow(&quot;HPE MyFlight Sample Applicatio&quot;).WpfTabStrip(&quot;WpfTabStrip&quot;).Select &quot;SEARCH ORDER&quot;&quot;.]]></Details>
<Time><![CDATA[30-03-2022 - 21:11:45]]></Time>
<TimeTick>1648654905</TimeTick>
<NodeArgs eType="Replay" icon="8" nRep="131" status="Failed" Source="E:\DataDrivenFramework\Driver\Driver4\Library1.qfl" SourceLine="30" >
<Disp><![CDATA[Run Error]]></Disp>
</NodeArgs>
</Step>
<Step rID="T33">
<Obj plainTxt="False" ><![CDATA[byNumberRadio]]></Obj>
<Details plainTxt="False" ><![CDATA[Cannot&nbsp;find&nbsp;the&nbsp;"byNumberRadio"&nbsp;object's&nbsp;parent&nbsp;"HPE&nbsp;MyFlight&nbsp;Sample&nbsp;Applicatio"&nbsp;(class&nbsp;WpfWindow).<br/>Verify&nbsp;that&nbsp;parent&nbsp;properties&nbsp;match&nbsp;an&nbsp;object&nbsp;currently&nbsp;displayed&nbsp;in&nbsp;your&nbsp;application.]]></Details>
<Time><![CDATA[30-03-2022 - 21:12:06]]></Time>
<TimeTick>1648654926</TimeTick>
<Step rID="T34">
<Obj plainTxt="False" ><![CDATA[HPE MyFlight Sample Applicatio]]></Obj>
<Details plainTxt="False" ><![CDATA[Object's physical description:<br>wpftypename = window<br>regexpwndtitle = HPE MyFlight Sample Application<br>devname = HPE MyFlight Sample Application<br>]]></Details>
<Time><![CDATA[30-03-2022 - 21:12:06]]></Time>
<TimeTick>1648654926</TimeTick>
<NodeArgs eType="Replay" icon="8" nRep="137" status="Warning" nType="Parent description" Source="E:\DataDrivenFramework\Driver\Driver4\Library1.qfl" SourceLine="-1" >
<Disp><![CDATA[HPE MyFlight Sample Applicatio]]></Disp>
</NodeArgs>
</Step>
<NodeArgs eType="Replay" icon="9" nRep="136" status="Failed" nType="Run Error" Source="E:\DataDrivenFramework\Driver\Driver4\Library1.qfl" SourceLine="-1" >
<Disp><![CDATA[byNumberRadio]]></Disp>
</NodeArgs>
</Step>
<NodeArgs eType="Context" icon="6" nRep="130" status="Failed" Source="E:\DataDrivenFramework\Driver\Driver4\Library1.qfl" SourceLine="-1" >
<Disp><![CDATA[HPE MyFlight Sample Applicatio]]></Disp>
</NodeArgs>
</Step>
<Step rID="T35">
<Obj plainTxt="False" ><![CDATA[HPE MyFlight Sample Applicatio]]></Obj>
<Details plainTxt="False" ><![CDATA[WpfWindow]]></Details>
<Time><![CDATA[30-03-2022 - 21:12:06]]></Time>
<TimeTick>1648654926</TimeTick>
<Step rID="T36">
<Obj plainTxt="False" ><![CDATA[Run Error]]></Obj>
<Details plainTxt="False" ><![CDATA[Cannot find the &quot;byNumberRadio&quot; object's parent &quot;HPE MyFlight Sample Applicatio&quot; (class WpfWindow).<BR/>Verify that parent properties match an object currently displayed in your application.<BR/>Function file: E:\DataDrivenFramework\Driver\Driver4\Library1.qfl<BR/>Line (32): &quot;WpfWindow(&quot;HPE MyFlight Sample Applicatio&quot;).WpfRadioButton(&quot;byNumberRadio&quot;).Set&quot;.]]></Details>
<Time><![CDATA[30-03-2022 - 21:12:06]]></Time>
<TimeTick>1648654926</TimeTick>
<NodeArgs eType="Replay" icon="8" nRep="139" status="Failed" Source="E:\DataDrivenFramework\Driver\Driver4\Library1.qfl" SourceLine="31" >
<Disp><![CDATA[Run Error]]></Disp>
</NodeArgs>
</Step>
<Step rID="T37">
<Obj plainTxt="False" ><![CDATA[byNumberWatermark]]></Obj>
<Details plainTxt="False" ><![CDATA[Cannot&nbsp;find&nbsp;the&nbsp;"byNumberWatermark"&nbsp;object's&nbsp;parent&nbsp;"HPE&nbsp;MyFlight&nbsp;Sample&nbsp;Applicatio"&nbsp;(class&nbsp;WpfWindow).<br/>Verify&nbsp;that&nbsp;parent&nbsp;properties&nbsp;match&nbsp;an&nbsp;object&nbsp;currently&nbsp;displayed&nbsp;in&nbsp;your&nbsp;application.]]></Details>
<Time><![CDATA[30-03-2022 - 21:12:06]]></Time>
<TimeTick>1648654926</TimeTick>
<Step rID="T38">
<Obj plainTxt="False" ><![CDATA[HPE MyFlight Sample Applicatio]]></Obj>
<Details plainTxt="False" ><![CDATA[Object's physical description:<br>wpftypename = window<br>regexpwndtitle = HPE MyFlight Sample Application<br>devname = HPE MyFlight Sample Application<br>]]></Details>
<Time><![CDATA[30-03-2022 - 21:12:06]]></Time>
<TimeTick>1648654926</TimeTick>
<NodeArgs eType="Replay" icon="8" nRep="141" status="Warning" nType="Parent description" Source="E:\DataDrivenFramework\Driver\Driver4\Library1.qfl" SourceLine="-1" >
<Disp><![CDATA[HPE MyFlight Sample Applicatio]]></Disp>
</NodeArgs>
</Step>
<NodeArgs eType="Replay" icon="10" nRep="140" status="Failed" nType="Run Error" Source="E:\DataDrivenFramework\Driver\Driver4\Library1.qfl" SourceLine="-1" >
<Disp><![CDATA[byNumberWatermark]]></Disp>
</NodeArgs>
</Step>
<Step rID="T39">
<Obj plainTxt="False" ><![CDATA[byNumberWatermark]]></Obj>
<Details plainTxt="False" ><![CDATA[Cannot&nbsp;find&nbsp;the&nbsp;"byNumberWatermark"&nbsp;object's&nbsp;parent&nbsp;"HPE&nbsp;MyFlight&nbsp;Sample&nbsp;Applicatio"&nbsp;(class&nbsp;WpfWindow).<br/>Verify&nbsp;that&nbsp;parent&nbsp;properties&nbsp;match&nbsp;an&nbsp;object&nbsp;currently&nbsp;displayed&nbsp;in&nbsp;your&nbsp;application.]]></Details>
<Time><![CDATA[30-03-2022 - 21:12:27]]></Time>
<TimeTick>1648654947</TimeTick>
<Step rID="T40">
<Obj plainTxt="False" ><![CDATA[HPE MyFlight Sample Applicatio]]></Obj>
<Details plainTxt="False" ><![CDATA[Object's physical description:<br>wpftypename = window<br>regexpwndtitle = HPE MyFlight Sample Application<br>devname = HPE MyFlight Sample Application<br>]]></Details>
<Time><![CDATA[30-03-2022 - 21:12:27]]></Time>
<TimeTick>1648654947</TimeTick>
<NodeArgs eType="Replay" icon="8" nRep="151" status="Warning" nType="Parent description" Source="E:\DataDrivenFramework\Driver\Driver4\Library1.qfl" SourceLine="-1" >
<Disp><![CDATA[HPE MyFlight Sample Applicatio]]></Disp>
</NodeArgs>
</Step>
<NodeArgs eType="Replay" icon="10" nRep="150" status="Failed" nType="Run Error" Source="E:\DataDrivenFramework\Driver\Driver4\Library1.qfl" SourceLine="-1" >
<Disp><![CDATA[byNumberWatermark]]></Disp>
</NodeArgs>
</Step>
<NodeArgs eType="Context" icon="6" nRep="138" status="Failed" Source="E:\DataDrivenFramework\Driver\Driver4\Library1.qfl" SourceLine="-1" >
<Disp><![CDATA[HPE MyFlight Sample Applicatio]]></Disp>
</NodeArgs>
</Step>
<Step rID="T41">
<Obj plainTxt="False" ><![CDATA[HPE MyFlight Sample Applicatio]]></Obj>
<Details plainTxt="False" ><![CDATA[WpfWindow]]></Details>
<Time><![CDATA[30-03-2022 - 21:12:27]]></Time>
<TimeTick>1648654947</TimeTick>
<Step rID="T42">
<Obj plainTxt="False" ><![CDATA[Run Error]]></Obj>
<Details plainTxt="False" ><![CDATA[Cannot find the &quot;byNumberWatermark&quot; object's parent &quot;HPE MyFlight Sample Applicatio&quot; (class WpfWindow).<BR/>Verify that parent properties match an object currently displayed in your application.<BR/>Function file: E:\DataDrivenFramework\Driver\Driver4\Library1.qfl<BR/>Line (33): &quot;WpfWindow(&quot;HPE MyFlight Sample Applicatio&quot;).WpfEdit(&quot;byNumberWatermark&quot;).Set &quot;7&quot;&quot;.]]></Details>
<Time><![CDATA[30-03-2022 - 21:12:27]]></Time>
<TimeTick>1648654947</TimeTick>
<NodeArgs eType="Replay" icon="8" nRep="153" status="Failed" Source="E:\DataDrivenFramework\Driver\Driver4\Library1.qfl" SourceLine="32" >
<Disp><![CDATA[Run Error]]></Disp>
</NodeArgs>
</Step>
<Step rID="T43">
<Obj plainTxt="False" ><![CDATA[SEARCH]]></Obj>
<Details plainTxt="False" ><![CDATA[Cannot&nbsp;find&nbsp;the&nbsp;"SEARCH"&nbsp;object's&nbsp;parent&nbsp;"HPE&nbsp;MyFlight&nbsp;Sample&nbsp;Applicatio"&nbsp;(class&nbsp;WpfWindow).<br/>Verify&nbsp;that&nbsp;parent&nbsp;properties&nbsp;match&nbsp;an&nbsp;object&nbsp;currently&nbsp;displayed&nbsp;in&nbsp;your&nbsp;application.]]></Details>
<Time><![CDATA[30-03-2022 - 21:12:27]]></Time>
<TimeTick>1648654947</TimeTick>
<Step rID="T44">
<Obj plainTxt="False" ><![CDATA[HPE MyFlight Sample Applicatio]]></Obj>
<Details plainTxt="False" ><![CDATA[Object's physical description:<br>wpftypename = window<br>regexpwndtitle = HPE MyFlight Sample Application<br>devname = HPE MyFlight Sample Application<br>]]></Details>
<Time><![CDATA[30-03-2022 - 21:12:27]]></Time>
<TimeTick>1648654947</TimeTick>
<NodeArgs eType="Replay" icon="8" nRep="155" status="Warning" nType="Parent description" Source="E:\DataDrivenFramework\Driver\Driver4\Library1.qfl" SourceLine="-1" >
<Disp><![CDATA[HPE MyFlight Sample Applicatio]]></Disp>
</NodeArgs>